{
  "schemaVersion": "1.0", "id": "resoverse.conformance.hold-dependency", "version": "1.0.0",
  "name": "Dependency Hold Fixture", "description": "Negative fixture declaring a runtime dependency prohibited by V1.",
  "entrypoint": "implementation.py", "dependencies": ["example-package"],
  "provenance": {"sourceUrl": "https://example.com", "license": "CC0-1.0", "authors": ["Commons fixture"], "rightsToSubmit": true},
  "permissions": {"network": [], "filesystemRead": [], "filesystemWrite": [], "environment": [], "subprocess": false},
  "limits": {"wallTimeSeconds": 5, "memoryMiB": 64},
  "learningUse": {"allowedInputs": [], "consent": "explicit_contribution", "automaticPromotion": false}
}
